{"$schema":"https://json-schema.org/draft/2020-12/schema","type":"object","additionalProperties":false,"required":["schema_version","canonicalization_version","policy_id","scheduler","active_work_package_id","active_pull_request","active_work_package_limit","pull_request_classification","merge_gates","runtime_state_source","legacy_control_state"],"properties":{"schema_version":{"const":1},"canonicalization_version":{"const":1},"policy_id":{"type":"string","minLength":3},"scheduler":{"type":"object","required":["mode","workflow","cadence_cron","automatic_planning","manual_task_request_required"],"properties":{"mode":{"const":"github_actions_hourly_planner"},"workflow":{"const":".github/workflows/work-package-control-plane.yml"},"cadence_cron":{"const":"17 * * * *"},"automatic_planning":{"const":true},"manual_task_request_required":{"const":false}}},"active_work_package_id":{"type":["string","null"]},"active_pull_request":{"type":["integer","null"]},"active_work_package_limit":{"const":1},"pull_request_classification":{"type":"object","required":["automation_labels","automation_branch_prefixes"],"properties":{"automation_labels":{"type":"array","minItems":1,"uniqueItems":true},"automation_branch_prefixes":{"type":"array","minItems":1,"uniqueItems":true}}},"merge_gates":{"type":"object","required":["required_workflows","blocking_review_states"],"properties":{"required_workflows":{"type":"array","minItems":1,"uniqueItems":true},"blocking_review_states":{"type":"array","minItems":1,"uniqueItems":true}}},"runtime_state_source":{"const":"github_api"},"legacy_control_state":{"const":"planning/CONTROL_STATE.json"}}}
