{"active_pull_request":null,"active_work_package_id":null,"active_work_package_limit":1,"canonicalization_version":1,"legacy_control_state":"planning/CONTROL_STATE.json","merge_gates":{"blocking_review_states":["CHANGES_REQUESTED"],"required_workflows":["KB Quality"]},"policy_id":"elementor-v4-work-package-policy","pull_request_classification":{"automation_branch_prefixes":["automation/wp-","migration/","migration-","hardening/work-package-control-plane-"],"automation_labels":["work-package"]},"runtime_state_source":"github_api","scheduler":{"automatic_planning":true,"cadence_cron":"17 * * * *","manual_task_request_required":false,"mode":"github_actions_hourly_planner","workflow":".github/workflows/work-package-control-plane.yml"},"schema_version":1}
